{
  "name": "John Doe",
  "age": 42,
  "isAdmin": false,
  "kernelModules": ["usbhid", "usb_storage"],
  "userIds": {
    "mic92": 1,
    "lassulus": 2,
    "davhau": 3
  },
  "services": {
    "opt": "this option doesn't make sense"
  },
  "destinations": {
    "test-backup": {
      "name": "John Doe",
      "repo": "test-backup"
    }
  },
  "userModules": {
    "some-user": {
      "foo": {}
    }
  }
}
